<?xml version="1.0" encoding="UTF-8" standalone="no"?>
<account xmlns="http://www.engr.iupui.edu/~efernand/account" xmlns:xsi="http://www.w3.org/2001/XMLSchema-instance" xsi:noNamespaceSchemaLocation="account.xsd" type="checking" number="C22233475" >
   <owner>
      <name>
         <first>Ashley</first>
         <last>Wilkes</last>
      </name>
      <address>
         <street>321 Ashburn</street>
         <city>Jasper</city>
         <state>MN</state>
         <zip>89831</zip>
      </address>
   </owner>
   <deposit type="direct">
      <from  category="income">Net World</from>
      <amount>1240.50</amount>
      <date>2005-08-24</date>
      <description>Paycheck</description>
   </deposit>

   <payment type="check" checknum="C1210">
      <to category="other">Hank's Hardware</to>
      <amount>29.15</amount>
      <date>2005-08-24</date>
      <description>Drill kit</description>
   </payment>

   <payment type="check" checknum="C1211">
      <to category="food">Food Mart</to>
      <amount>149.51</amount>
      <date>2005-08-25</date>
   </payment>

   <payment type="check" checknum="C1212">
      <to category="other">Citgo</to>
      <amount>22.50</amount>
      <date>2005-08-25</date>
      <description>Gasoline</description>
   </payment>

   <payment type="check" checknum="C1213">
      <to category="food">Pizza Now</to>
      <amount>33.24</amount>
      <date>2005-08-28</date>
      <description>Dinner</description>
   </payment>

   <deposit type="cash">
      <from category="cash">cash</from>
      <amount>200</amount>
      <date>2005-08-29</date>
   </deposit>

   <payment type="transfer" >
      <to category="utilities">Central Electric</to>
      <amount>94.85</amount>
      <date>2005-08-29</date>
      <description>Electric Bill</description>
   </payment>

   <payment type="atm">
      <to category="cash">cash</to>
      <amount>200</amount>
      <date>2005-08-20</date>
   </payment>

   <payment type="check" checknum="C1215">
      <to category="clothing">L.S.Ayres</to>
      <amount>172.50</amount>
      <date>2005-08-30</date>
      <description>New pants, shirt</description>
   </payment>

   <payment type="check" checknum="C1216">
      <to category="food">Food Mart</to>
      <amount>89.11</amount>
      <date>2005-08-30</date>
      <description>Groceries</description>
   </payment>

   <deposit type="transfer">
      <from category="savings">Saving Account</from>
      <amount>300</amount>
      <date>2005-09-01</date>
   </deposit>

   <payment type="check" checknum="C1217">
      <to category="entertainment">Ticket Source</to>
      <amount>115.95</amount>
      <date>2005-09-03</date>
      <description>Tickets for the Jazz Concert</description>
   </payment>
</account>